{
  "schemaVersion": 1,
  "contractId": "sccm-site-database-export",
  "intent": "captureMore",
  "captureState": "partial",
  "authorization": {
    "authorizationId": "cmtraceopen.sccm.dbexport.authorization.sha256.v1:aaaaaaaaaaaaaaaaaaaaaaaaaaaaaaaaaaaaaaaaaaaaaaaaaaaaaaaaaaaaaaaa",
    "authorizerHandle": "cmtraceopen.operator.sha256.v1:bbbbbbbbbbbbbbbbbbbbbbbbbbbbbbbbbbbbbbbbbbbbbbbbbbbbbbbbbbbbbbbb",
    "authorizedAtUtc": "2026-08-04T12:00:00Z",
    "decision": "granted",
    "scope": "coverageOnlySccmSiteDatabaseExport"
  },
  "provenance": {
    "siteHandle": "cmtraceopen.site.sha256.v1:cccccccccccccccccccccccccccccccccccccccccccccccccccccccccccccccc",
    "databaseHandle": "cmtraceopen.database.sha256.v1:dddddddddddddddddddddddddddddddddddddddddddddddddddddddddddddddd",
    "exporterHostHandle": "cmtraceopen.host.sha256.v1:eeeeeeeeeeeeeeeeeeeeeeeeeeeeeeeeeeeeeeeeeeeeeeeeeeeeeeeeeeeeeeee",
    "exportProfileId": "sccm-site-database-export-v1",
    "exportStartedUtc": "2026-08-04T12:01:00Z",
    "exportCompletedUtc": "2026-08-04T12:02:00Z"
  },
  "snapshot": {
    "snapshotId": "cmtraceopen.sccm.dbexport.snapshot.sha256.v1:ffffffffffffffffffffffffffffffffffffffffffffffffffffffffffffffff",
    "capturedAtUtc": "2026-08-04T12:02:00Z",
    "complete": false,
    "summary": {
      "activeClientCount": 12,
      "managedDeviceCount": 34,
      "packageCount": 5,
      "deploymentCount": 6
    }
  },
  "integrity": {
    "algorithm": "sha256",
    "canonicalPayloadSha256": "fac7ddd3a152a6fbd73c60e0c570871866e003223cbe9692c10148f550642955"
  }
}
